{
  "schema_version": "1",
  "decision_id": "ambiguity:contextual-stone:1-permuted",
  "policy": "ContextualDeterministic",
  "decision_status": "Selected",
  "profile": {
    "profile_id": "ambiguity-profile:contextual-reference",
    "profile_revision": "1",
    "ordering_revision": "1",
    "ranking_rules": [
      {
        "rule_id": "context:possessor-match",
        "input": "ContextualEvidence",
        "comparator": "BooleanTrueFirst",
        "missing_value": "Unreproducible",
        "evidence_required": true,
        "description": "Prefer the candidate supported by the recorded possessor relation."
      }
    ],
    "final_tie_break": [
      "SemanticFingerprintAscending",
      "CandidateIdAscending"
    ]
  },
  "context_snapshot": {
    "snapshot_id": "context:casting-scene:42",
    "snapshot_revision": "7",
    "fact_ids": ["fact:fire-owns-stone"],
    "evidence_ids": ["evidence:world-index:stone-possession:7"]
  },
  "candidate_set": {
    "candidate_set_id": "candidate-set:stone-reference",
    "candidate_set_revision": "1",
    "input_candidate_ids": [
      "candidate:stone-of-fire",
      "candidate:stone-near-fire"
    ],
    "canonical_candidate_ids": [
      "candidate:stone-near-fire",
      "candidate:stone-of-fire"
    ],
    "candidates": [
      {
        "candidate_id": "candidate:stone-of-fire",
        "semantic_fingerprint": "sf:v1:sha256:bbbbbbbbbbbbbbbbbbbbbbbbbbbbbbbbbbbbbbbbbbbbbbbbbbbbbbbbbbbbbbbb",
        "normalization_valid": true,
        "semantic_critical": true,
        "evidence_ids": [
          "evidence:surface:genitive-relation",
          "evidence:world-index:stone-possession:7"
        ],
        "assumption_ids": []
      },
      {
        "candidate_id": "candidate:stone-near-fire",
        "semantic_fingerprint": "sf:v1:sha256:aaaaaaaaaaaaaaaaaaaaaaaaaaaaaaaaaaaaaaaaaaaaaaaaaaaaaaaaaaaaaaaa",
        "normalization_valid": true,
        "semantic_critical": true,
        "evidence_ids": ["evidence:surface:genitive-relation"],
        "assumption_ids": ["assumption:near-relation"]
      }
    ]
  },
  "ranking_evaluations": [
    {
      "candidate_id": "candidate:stone-of-fire",
      "eligible": true,
      "rank_terms": [
        {
          "rule_id": "context:possessor-match",
          "value": true,
          "evidence_ids": ["evidence:world-index:stone-possession:7"]
        }
      ],
      "rejection_reason_ids": []
    },
    {
      "candidate_id": "candidate:stone-near-fire",
      "eligible": true,
      "rank_terms": [
        {
          "rule_id": "context:possessor-match",
          "value": false,
          "evidence_ids": ["evidence:world-index:stone-possession:7"]
        }
      ],
      "rejection_reason_ids": []
    }
  ],
  "selected_candidate_id": "candidate:stone-of-fire",
  "rejected_candidate_ids": ["candidate:stone-near-fire"],
  "unresolved_assumption_ids": [],
  "mandatory_downstream_checks": [
    "type",
    "authority",
    "conservation",
    "identity"
  ],
  "diagnostics": [],
  "replay": {
    "replay_status": "Reproduced",
    "recorded_profile_revision": "1",
    "recorded_ordering_revision": "1",
    "recorded_context_snapshot_id": "context:casting-scene:42",
    "recorded_context_snapshot_revision": "7",
    "recorded_candidate_set_id": "candidate-set:stone-reference",
    "recorded_candidate_set_revision": "1",
    "recorded_selected_candidate_id": "candidate:stone-of-fire",
    "recorded_selected_semantic_fingerprint": "sf:v1:sha256:bbbbbbbbbbbbbbbbbbbbbbbbbbbbbbbbbbbbbbbbbbbbbbbbbbbbbbbbbbbbbbbb",
    "diagnostic_code": null
  }
}
